question_no,question,answer
1,You are asked to finish a large number of tasks within a day. How would you manage that?,"I will group them according to their level of priority and prioritize them. If the task is urgent and critical, I will finish it first. For the complicated task, I will break down the task into several pieces and finish it step by step. If I know I cannot finish it within a day, I will communicate with my supervisor to see if the deadline can be extended or if some colleagues can give help."
2,Everyone makes mistakes. How would you rectify the situation if you fail to meet the expectation?,"Once I know I made a mistake, I will admit my mistake to my supervisor and see if there are any bad influence on others. Then I rectify my mistakes as soon as possible. To prevent making the same type of mistake again, I will self reflect on what caused the mistake and find the source of the mistake and learn from it and grow."
3,When there is an expansion of your team and many new teammates join in. How would you adjust for this?,"I will be friendly to them and give a helpful hand whenever they need it. Then, I will see if my supervisor has any training plan for the new teammates in which I can contribute my experience and knowledge. Clear division of labor and communication is needed since the team is getting larger."
4,"If you are 100% sure that your boss’s idea is wrong, what would you do?","I will step up, voice out, and justify to my boss that this is not a good idea. In a calm manner I shall explain the wrong things in his idea at the same time with facts and justifications. I will suggest that he gather more ideas and opinions from other teammates. It is important to be direct but in a manner such that he does not get offended and understands my point."
5,"Assume you are the boss and one of your employees have been severely underperforming, what will you do?","I will sit down with him or her and have an honest conversation. A will initiate a discussion on what is causing the underperformance and why is it happening. I will not judge a book by its cover as they may be some very sensitive things are he or she is facing personally. After understanding the situation, I will assess and provide advice to that employee on how to get back on track."
